title,score,url,num_comments,created_utc,selftext,comments,cleaned_selftext,cleaned_title,cleaned_comments,selftext_sentiment,title_sentiment,comments_sentiment,title_sentiment_category,comments_sentiment_category
"Tesla to offer free 1 month trial of FSD Beta to all Tesla owners in North America once it's ""super smooth.""",1570,https://twitter.com/elonmusk/status/1655629768279089171?s=46,586,1683568852,,"['Resources: [Official Support](https://www.tesla.com/support) | r/TeslaLounge for personal content and r/TeslaInvestorsClub for all things $TSLA | r/TeslaSupport and the [Wiki/FAQ](https://www.reddit.com/r/teslamotors/wiki/index) for unofficial questions + help | [Discord Live Chat](https://discord.gg/tesla) | Assist the Mods by **reporting posts and comments** which break [rules](https://www.reddit.com/r/teslamotors/wiki/rules)\n\n\n*I am a bot, and this action was performed automatically. Please [contact the moderators of this subreddit](/message/compose/?to=/r/teslamotors) if you have any questions or concerns.*', 'Once it’s “super smooth”, so uhh when is that?', ""Insurance just totaled my 2018 model 3 last week. So I ordered a model Y and there is no way I'm paying 15k for what I paid 3k for  in 2019.. I like FSD, but if they don't offer some sort of customer loyalty discount, I cant Imagine ever getting it again."", '[deleted]', 'Maybe they could start by compensating those who bought the subscription month after month in hopes to get beta after Musk said anyone who wants it can have it. I know a few people that are still waiting post FSD recall to get the software.']",no content,tesla to offer free 1 month trial of fsd beta to all tesla owners in north america once its super smooth,['resources official support rteslalounge for personal content and rteslainvestorsclub for all things tsla rteslasupport and the wikifaq for unofficial questions help discord live chat assist the mods by reporting posts and comments which break rules am a bot and this action was performed automatically please contact the moderators of this subredditmessagecomposetorteslamotors if you have any questions or concerns once its super smooth so uhh when is that insurance just totaled my 2018 model 3 last week so i ordered a model y and there is no way im paying 15k for what i paid 3k for in 2019 i like fsd but if they dont offer some sort of customer loyalty discount i cant imagine ever getting it again deleted maybe they could start by compensating those who bought the subscription month after month in hopes to get beta after musk said anyone who wants it can have it i know a few people that are still waiting post fsd recall to get the software'],-0.296,0.802,[0.9203],Positive,Positive
"Elon: ""Tonight, we radically increased the design goals for the new Tesla Roadster."". Says 0-60 less than 1 second, and ""that's the least interesting part""",642,https://twitter.com/elonmusk/status/1762716007913652650,796,1709100921,,"['As we are not a support sub, please make sure to use the proper resources if you have questions: Our Stickied Community Q&A Post, [Official Tesla Support](https://www.tesla.com/support), [r/TeslaSupport](https://www.reddit.com/r/TeslaSupport/) | [r/TeslaLounge](https://www.reddit.com/r/TeslaLounge/) personal content | [Discord Live Chat](https://discord.gg/tesla) for anything.\n\n\n*I am a bot, and this action was performed automatically. Please [contact the moderators of this subreddit](/message/compose/?to=/r/teslamotors) if you have any questions or concerns.*', 'I laugh if the under one second 0 to 60 is the first time the engineers are hearing about this', ""I mean I very much hope this is true but the roadster is so delayed it's not even funny. \nEven now I imagine the model 2 is next to be released and THEN the roadster"", 'Say it will be delayed even more without saying it will be delayed even more', 'Seems like a cybertruck with 500 miles of range would be easier to create within the laws of physics compared to a car that can do 0-60 in <1 sec. I’m not holding my breath at this point.']",no content,elon tonight we radically increased the design goals for the new tesla roadster says 060 less than 1 second and thats the least interesting part,['as we are not a support sub please make sure to use the proper resources if you have questions our stickied community qa post official tesla support rteslasupport rteslalounge personal content discord live chat for anythingnnni am a bot and this action was performed automatically please contact the moderators of this subredditmessagecomposetorteslamotors if you have any questions or concerns i laugh if the under one second 0 to 60 is the first time the engineers are hearing about this i mean i very much hope this is true but the roadster is so delayed its not even funny neven now i imagine the model 2 is next to be released and then the roadster say it will be delayed even more without saying it will be delayed even more seems like a cybertruck with 500 miles of range would be easier to create within the laws of physics compared to a car that can do 060 in 1 sec im not holding my breath at this point'],-0.296,-0.0408,[0.7637],Neutral,Positive
"You’re right, we should credit Tesla owners $100 if we change appointments with less than 24 hours notice. Should be reciprocal.",4292,https://i.redd.it/ilrafo986om91.jpg,290,1662657959,,"['Resources: [Tesla Official Support](https://www.tesla.com/support) | [Wiki/FAQ](https://www.reddit.com/r/teslamotors/wiki/index) | [Discord Chat](https://discord.gg/tesla) | [Support Thread](https://www.reddit.com/r/teslamotors/comments/vp075g/your_tesla_support_thread_q3_2022/) | r/TeslaLounge for personal content | Help the Mods by **reporting posts and comments** which break [rules](https://www.reddit.com/r/teslamotors/wiki/rules).\n\n\n*I am a bot, and this action was performed automatically. Please [contact the moderators of this subreddit](/message/compose/?to=/r/teslamotors) if you have any questions or concerns.*', '[Follow up. ](https://i.imgur.com/5lbbTr9.jpg)', '*store credit* lol', 'Sounds like he learned about the [Costanza Cancellation Policy](https://www.youtube.com/watch?v=ECmtCdUtEMI).', ""This also just happened to me. I got a message less than 24 hours before my appointment telling me that they just realised that my appointment would need me to leave the car overnight and if I wasn't prepared for that then I would need to reschedule. Of course I wasn't so I am now a month out from my original appointment. Oh, and they told me they'd have no vouchers or loaner cars available.""]",no content,youre right we should credit tesla owners 100 if we change appointments with less than 24 hours notice should be reciprocal,['resources tesla official support wikifaq discord chat support thread rteslalounge for personal content help the mods by reporting posts and comments which break rules am a bot and this action was performed automatically please contact the moderators of this subredditmessagecomposetorteslamotors if you have any questions or concerns follow up store credit lol sounds like he learned about the costanza cancellation policy this also just happened to me i got a message less than 24 hours before my appointment telling me that they just realised that my appointment would need me to leave the car overnight and if i wasnt prepared for that then i would need to reschedule of course i wasnt so i am now a month out from my original appointment oh and they told me theyd have no vouchers or loaner cars available'],-0.296,0.3818,[0.9158],Positive,Positive
Elon Musk Says He Turned Down Bill Gates Philanthropy Over Tesla Short,2387,https://finance.yahoo.com/news/elon-musk-confirmed-leaked-texts-061925468.html,870,1650722292,,"['**Report comments from those who obviously came here to start trouble and stir the pot, with no intent to participate in good faith.**\n\nPeople should be able to have discussions on a topic without it going overboard. We don’t care who you like or dislike, just discuss maturely.', 'Bill Gates in The Little Short. Coming to an AMC theater near you.', 'Should Elon be pointing out the fact that Gates is out of shape?  Seems like pot calling the kettle black, no?', 'There was a time when a short on Tesla was a bet against Elon Musk. But somewhere it became a reasonable short just on valuation alone and I don’t think Musk would disagree with that.\n\nHowever asking someone to collaborate with you when you have a massive bet hoping that the most significant thing they do on fails is a bit disingenuous.', 'Grabbing my popcorn for the mainstream subs’ comments on this news. Already saw a comment about how Microsoft Teams does more for the environment than Tesla and other twists on how Tesla isn’t environmentally friendly.']",no content,elon musk says he turned down bill gates philanthropy over tesla short,['report comments from those who obviously came here to start trouble and stir the pot with no intent to participate in good faithnnpeople should be able to have discussions on a topic without it going overboard we dont care who you like or dislike just discuss maturely bill gates in the little short coming to an amc theater near you should elon be pointing out the fact that gates is out of shape seems like pot calling the kettle black no there was a time when a short on tesla was a bet against elon musk but somewhere it became a reasonable short just on valuation alone and i dont think musk would disagree with thatnnhowever asking someone to collaborate with you when you have a massive bet hoping that the most significant thing they do on fails is a bit disingenuous grabbing my popcorn for the mainstream subs comments on this news already saw a comment about how microsoft teams does more for the environment than tesla and other twists on how tesla isnt environmentally friendly'],-0.296,0.0,[-0.8367],Neutral,Negative
"Elon Musk calls for Senate not to pass the Build Back Better Act: 'Tesla doesn't need the $7,500'",2378,https://electrek.co/2021/12/07/elon-musk-senate-not-pass-build-back-better-act-tesla-doesnt-need/,1363,1638903791,,"['If help is needed, use our stickied support thread, or [Tesla Support](https://www.tesla.com/support) + [Autopilot](https://www.tesla.com/support/autopilot) for understanding.  Everyone, please read our [Rules](https://www.reddit.com/r/teslamotors/wiki/rules) and a [note](https://www.reddit.com/r/teslamotors/wiki/rules#wiki_special_note_from_the_moderators) from the Mods. Be respectful, please remember to Report (it helps Mods immensely), and comment with a focus on moving discussion forward.  \n\n\n*I am a bot, and this action was performed automatically. Please [contact the moderators of this subreddit](/message/compose/?to=/r/teslamotors) if you have any questions or concerns.*', 'Tesla doesn’t need it, but ReallyFastTyper does!', 'I do though', ""He is saying, Tesla doesn't need the credit to sell cars. Obviously true since they are selling everything they make. \n\nFrom a consumer point of view, he was saying that subsidies are pushing the US govt into more and more debt, so he is against it for all industries not just electric.\n\nI think he made some fair points, but these credits should be seen as an incentive to push people to electric rather than a subsidy. I think anything that pushes more electric over ICE is good. \n\nGovt. spending is a complex topic but I'd rather the spending was focused on infra than on the military. By this I mean the defense focused private companies that get contracts worth trillions of dollars."", ""People here didn't listen to the interview. Elon actually said he would rather have no subsidies affecting the car market. That means Ev subsidies but also more importantly subsidies on gas and oil""]",no content,elon musk calls for senate not to pass the build back better act tesla doesnt need the 7500,['if help is needed use our stickied support thread or tesla support autopilot for understanding everyone please read our rules and a note from the mods be respectful please remember to report it helps mods immensely and comment with a focus on moving discussion forward nnni am a bot and this action was performed automatically please contact the moderators of this subredditmessagecomposetorteslamotors if you have any questions or concerns tesla doesnt need it but reallyfasttyper does i do though he is saying tesla doesnt need the credit to sell cars obviously true since they are selling everything they make nnfrom a consumer point of view he was saying that subsidies are pushing the us govt into more and more debt so he is against it for all industries not just electricnni think he made some fair points but these credits should be seen as an incentive to push people to electric rather than a subsidy i think anything that pushes more electric over ice is good nngovt spending is a complex topic but id rather the spending was focused on infra than on the military by this i mean the defense focused private companies that get contracts worth trillions of dollars people here didnt listen to the interview elon actually said he would rather have no subsidies affecting the car market that means ev subsidies but also more importantly subsidies on gas and oil'],-0.296,0.4404,[0.9833],Positive,Positive
UPDATE: Ford spokesperson: Madra’s tweet ‘was tongue-in-cheek’ and meant to point out the absurdity of Tesla’s tow video.”,5453,https://insideevs.com/news/384376/ford-tesla-tow-challenge-f150-cybertruck/,1096,1574763555,,"['[deleted]', 'Tesla doesn’t need Ford....they can just borrow or buy an F-150 with the 3.5L Ecoboost engine and conduct the test on their own.\n\nThey could get real life long Ford owners to bring their trucks and turn it into one of those stupid commercials where everyone is surprised at how great the Cybertruck is.', 'Just do it without them with all the versions from cheapest to most expensive F150?', ""Ford should just bring out the F-150 electric prototype that they showed pulling 1 million pounds of weight. Electric prototype vs electric prototype makes it a fair fight in terms of weight and instant torque.\n\nAnyways, Elon has said they will be doing tug of war next week so it doesn't matter if Ford is pulling out of this contest"", '\'its just a prank bro""']",no content,update ford spokesperson madras tweet was tongueincheek and meant to point out the absurdity of teslas tow video,['deleted tesla doesnt need fordthey can just borrow or buy an f150 with the 35l ecoboost engine and conduct the test on their ownnnthey could get real life long ford owners to bring their trucks and turn it into one of those stupid commercials where everyone is surprised at how great the cybertruck is just do it without them with all the versions from cheapest to most expensive f150 ford should just bring out the f150 electric prototype that they showed pulling 1 million pounds of weight electric prototype vs electric prototype makes it a fair fight in terms of weight and instant torquennanyways elon has said they will be doing tug of war next week so it doesnt matter if ford is pulling out of this contest its just a prank bro'],-0.296,0.0,[-0.4474],Neutral,Negative
"CEO steps down after being hit with expensive EV repairs and low resale prices following purchase of 100,000 Teslas",961,https://fortune.com/2024/03/15/ceo-steps-down-prices-following-purchase-teslas/,335,1710637704,,"['As we are not a support sub, please make sure to use the proper resources if you have questions: Our Stickied Community Q&A Post, [Official Tesla Support](https://www.tesla.com/support), [r/TeslaSupport](https://www.reddit.com/r/TeslaSupport/) | [r/TeslaLounge](https://www.reddit.com/r/TeslaLounge/) personal content | [Discord Live Chat](https://discord.gg/tesla) for anything.\n\n\n*I am a bot, and this action was performed automatically. Please [contact the moderators of this subreddit](/message/compose/?to=/r/teslamotors) if you have any questions or concerns.*', 'I tried to rent a Tesla through hertz several times.\n\nThey couldn’t even satisfy the demand of a willing customer familiar with EVs.\n\nThey never installed dedicated charging spots for their fleets.', 'I own a Tesla and considered renting one on a trip to San Diego. The policy had clauses in it about returning with 90% battery but the nearest charger was over 20 min away. I don’t recall specifics now but remember it read very punitive and uninviting. Hertz did not seem prepared to offer an EV rental. Over time they will get it though.', 'I’m pretty surprised Tesla didn’t work with Hertz more on this. Like give discounts and have an easy path for repairs and work with them on customer friendliness and charging. \n\nSeems like it was a huge opportunity to get new customers in seats and get potential buyers. Also it could help them since fleet sales in a slow quarter can really smooth out demand issues.', 'Poor bastard sounds like a sacrificial lamb for a company suffering otherwise bad financials.  \n\nHertz did just fine with Teslas rented... most they are selling or sold are pretty high mileage and lots of the photos show they\'ve been beat to shit like most rentals end up before rotating out. They didn\'t suddenly decide to liquidate their EV inventory, they used them up and it was time to get the future tire replacements, brake pads, interior damage repairs, etc. out of the stable.  \n\nProblem was EV prices depressed since they invested in the fleet and they could not get their budgeted ""residual value"" out of them in their normally inflated resale prices of worn out rentals on their Hertz Sales lots or at auction.\n\nThe company fucked up. He gets to be the head on the stick.']",no content,ceo steps down after being hit with expensive ev repairs and low resale prices following purchase of 100000 teslas,['as we are not a support sub please make sure to use the proper resources if you have questions our stickied community qa post official tesla support rteslasupport rteslalounge personal content discord live chat for anythingnnni am a bot and this action was performed automatically please contact the moderators of this subredditmessagecomposetorteslamotors if you have any questions or concerns i tried to rent a tesla through hertz several timesnnthey couldnt even satisfy the demand of a willing customer familiar with evsnnthey never installed dedicated charging spots for their fleets i own a tesla and considered renting one on a trip to san diego the policy had clauses in it about returning with 90 battery but the nearest charger was over 20 min away i dont recall specifics now but remember it read very punitive and uninviting hertz did not seem prepared to offer an ev rental over time they will get it though im pretty surprised tesla didnt work with hertz more on this like give discounts and have an easy path for repairs and work with them on customer friendliness and charging nnseems like it was a huge opportunity to get new customers in seats and get potential buyers also it could help them since fleet sales in a slow quarter can really smooth out demand issues poor bastard sounds like a sacrificial lamb for a company suffering otherwise bad financials nnhertz did just fine with teslas rented most they are selling or sold are pretty high mileage and lots of the photos show theyve been beat to shit like most rentals end up before rotating out they didnt suddenly decide to liquidate their ev inventory they used them up and it was time to get the future tire replacements brake pads interior damage repairs etc out of the stable nnproblem was ev prices depressed since they invested in the fleet and they could not get their budgeted residual value out of them in their normally inflated resale prices of worn out rentals on their hertz sales lots or at auctionnnthe company fucked up he gets to be the head on the stick'],-0.296,-0.2732,[-0.3891],Negative,Negative
"Tesla says ALL new Model 3 vehicles in the US now qualify for the full $7,500 EV tax credit, meaning the Model 3 now starts at $32,740 (with incentives). In some states, you can get it for under $30k.",1532,https://twitter.com/SawyerMerritt/status/1664723258627817478?s=20,532,1685736614,,"['Resources: [Tesla Support](https://www.tesla.com/support) | r/TeslaLounge (personal content) | [Discord Live Chat](https://discord.gg/tesla) | Assist the Mod team - **Report Posts and Comments** violating our [rules](https://www.reddit.com/r/teslamotors/wiki/rules). Thank you! <3\n\n\n*I am a bot, and this action was performed automatically. Please [contact the moderators of this subreddit](/message/compose/?to=/r/teslamotors) if you have any questions or concerns.*', 'Current inventory shows 7500 off, along with being marked down almost 2500 the people in CO should be flooded with them due to additional 5k off', ""These incentives apply to new discounted inventory Model 3s. I looked into all local state EV incentives. Here's how cheap you can get a new Model 3 RWD right now (including fed & local EV incentives): - https://twitter.com/SawyerMerritt/status/1664740750955892737?s=20\n\n• VT: $26,320\n\n• MA: $26,830\n\n• PA: $27,330\n\n• RI: $27,820\n\n• DE: $27,820\n\n• NY: $28,320\n\n• CA: $28,330\n\n• CO: $28,330\n\n• CT: $29,030\n\n• ME: $29,320"", 'This is nuts, in California I can get a 5,500 state rebate on top of the 7,500 fed rebate.  There’s a white model 3 in existing inventory for 37,830 near me.  That’s a <25k Tesla after rebates.  If only our 2nd car didn’t need to be a large suv I would just get another model 3.', ""I guess they're switching back to 2170 for the RWD in the US. \n\nMaybe by moving Canadian sales to Shanghai LFP cars, there's enough 2170 left over.""]",no content,tesla says all new model 3 vehicles in the us now qualify for the full 7500 ev tax credit meaning the model 3 now starts at 32740 with incentives in some states you can get it for under 30k,['resources tesla support rteslalounge personal content discord live chat assist the mod team report posts and comments violating our rules thank you 3nnni am a bot and this action was performed automatically please contact the moderators of this subredditmessagecomposetorteslamotors if you have any questions or concerns current inventory shows 7500 off along with being marked down almost 2500 the people in co should be flooded with them due to additional 5k off these incentives apply to new discounted inventory model 3s i looked into all local state ev incentives heres how cheap you can get a new model 3 rwd right now including fed local ev incentives vt 26320nn ma 26830nn pa 27330nn ri 27820nn de 27820nn ny 28320nn ca 28330nn co 28330nn ct 29030nn me 29320 this is nuts in california i can get a 5500 state rebate on top of the 7500 fed rebate theres a white model 3 in existing inventory for 37830 near me thats a 25k tesla after rebates if only our 2nd car didnt need to be a large suv i would just get another model 3 i guess theyre switching back to 2170 for the rwd in the us nnmaybe by moving canadian sales to shanghai lfp cars theres enough 2170 left over'],-0.296,0.5994,[0.7096],Positive,Positive
Toyota Corolla lost the title of best-selling car in the world for the first time in 20 years. Tesla Model Y is the new king,1263,https://gadgettendency.com/toyota-corolla-lost-the-title-of-best-selling-car-in-the-world-for-the-first-time-in-20-years-tesla-model-y-is-the-new-king/,226,1711363604,,"['As we are not a support sub, please make sure to use the proper resources if you have questions: [Official Tesla Support](https://www.tesla.com/support), [r/TeslaSupport](https://www.reddit.com/r/TeslaSupport/) | [r/TeslaLounge](https://www.reddit.com/r/TeslaLounge/) personal content | [Discord Live Chat](https://discord.gg/tesla) for anything.\n\n\n*I am a bot, and this action was performed automatically. Please [contact the moderators of this subreddit](/message/compose/?to=/r/teslamotors) if you have any questions or concerns.*', 'Imagine if Toyota actually sold an EV Corolla. Few frills, just the exact same car at a low price, but as an EV.', '""The Toyota RAV4 model dropped to 1st place with a result of 934,910 units"" \n\nI hate when I drop to 1st place.', ""Wow, that's super nice to hear, way more to go and achieve."", 'Insane feat for a twice as expensive car to become the best selling car.']",no content,toyota corolla lost the title of bestselling car in the world for the first time in 20 years tesla model y is the new king,['as we are not a support sub please make sure to use the proper resources if you have questions official tesla support rteslasupport rteslalounge personal content discord live chat for anythingnnni am a bot and this action was performed automatically please contact the moderators of this subredditmessagecomposetorteslamotors if you have any questions or concerns imagine if toyota actually sold an ev corolla few frills just the exact same car at a low price but as an ev the toyota rav4 model dropped to 1st place with a result of 934910 units nni hate when i drop to 1st place wow thats super nice to hear way more to go and achieve insane feat for a twice as expensive car to become the best selling car'],-0.296,-0.3182,[0.9113],Negative,Positive
