title,score,url,num_comments,created_utc,selftext,comments,cleaned_selftext,cleaned_title,cleaned_comments,selftext_sentiment,title_sentiment,comments_sentiment,title_sentiment_category,comments_sentiment_category
"""Tesla will be sooo screwed once they get competition""",4475,https://i.redd.it/fcw17iqov1p51.png,657,1600933635,,"['i think a price/range instead of just range would be a better comparision.', 'Kona, Niro, ID.3, polestar 2...\n\nI love my model 3 but this shit is misleading.', ""This is missing loads of cars isn't it? Where are the Chinese cars? Polestar 2?"", 'None of that is competition lol the Corolla outsells the s class that doesn’t mean Mercedes is nervous. There’s more to competition than just being electric.', ""I think you should redo this chart using the WLTP standard instead of the EPA standard.  In my country the Model X gets a maximum rating of 314 miles of range, while the e-Tron gets 270 and the ID.4 gets 310, despite both being significantly less expensive.\n\nEdit: Also, the e-Golf isn't really being sold anymore, should be replaced with the ID.3 which gets 340 miles of range.""]",no content,tesla will be sooo screwed once they get competition,['i think a pricerange instead of just range would be a better comparision kona niro id3 polestar 2nni love my model 3 but this shit is misleading this is missing loads of cars isnt it where are the chinese cars polestar 2 none of that is competition lol the corolla outsells the s class that doesnt mean mercedes is nervous theres more to competition than just being electric i think you should redo this chart using the wltp standard instead of the epa standard in my country the model x gets a maximum rating of 314 miles of range while the etron gets 270 and the id4 gets 310 despite both being significantly less expensivennedit also the egolf isnt really being sold anymore should be replaced with the id3 which gets 340 miles of range'],-0.296,-0.4939,[-0.8236],Negative,Negative
"It’s nice that we can enjoy Tesla’s now, but would you give all your life savings for it to exists? Elon did.",10670,https://i.redd.it/wjt1ujh6frs21.jpg,514,1555478670,,"['The biography on him is good. He had to borrow from friends and family too. One test launch away from bankruptcy.', 'The biography on him goes into this a bit.  He was so broke that Christmas he even had to borrow a few bucks to buy his girlfriend at the time a Christmas present. Then for a call that Investment came through with a massive amount of funding (think it was Daimler?) just as they were right up against the wall. He really did put it all on the line.\n\nEdit : he was also at a point where he was being recommended to let one go to the wall, be it either Tesla or SpaceX but he couldn’t face that, comparing it to sacrificing one of your two children\n\nEdit2 : thanks to u/sierra120 for the correction that it’s NASA (for SpaceX) and not Daimler (for Tesla) that called him up that Christmas Eve', 'He is a madman and not a good stockholder’s CEO but madmen leave a mark on the world when it’s all said and done and he’s done it. Love him or hate him you have to admire his drive and dedication to his own self imposed goals.', 'I financed for the first time in my life to drive a Tesla. Worth the savings, and being part of the future a little early.', 'What, believing in saving the environment and helping move to a more sustainable way of transportation? \nYeah, here’s all of 12,66€!']",no content,its nice that we can enjoy teslas now but would you give all your life savings for it to exists elon did,['the biography on him is good he had to borrow from friends and family too one test launch away from bankruptcy the biography on him goes into this a bit he was so broke that christmas he even had to borrow a few bucks to buy his girlfriend at the time a christmas present then for a call that investment came through with a massive amount of funding think it was daimler just as they were right up against the wall he really did put it all on the linennedit he was also at a point where he was being recommended to let one go to the wall be it either tesla or spacex but he couldnt face that comparing it to sacrificing one of your two childrennnedit2 thanks to usierra120 for the correction that its nasa for spacex and not daimler for tesla that called him up that christmas eve he is a madman and not a good stockholders ceo but madmen leave a mark on the world when its all said and done and hes done it love him or hate him you have to admire his drive and dedication to his own self imposed goals i financed for the first time in my life to drive a tesla worth the savings and being part of the future a little early what believing in saving the environment and helping move to a more sustainable way of transportation nyeah heres all of 1266'],-0.296,0.4588,[0.9029],Positive,Positive
"Tesla fired New York workers 'in retaliation for union activity,' complaint alleges | Workers at an Autopilot facility recently filed a notice to unionize.",1926,https://www.engadget.com/tesla-fired-new-york-workers-in-retaliation-for-union-activity-complaint-alleges-113727293.html,411,1676548990,,"['Resources: [Official Tesla Support](https://www.tesla.com/support) | [Wiki/FAQ](https://www.reddit.com/r/teslamotors/wiki/index) | [Discord Chat](https://discord.gg/tesla) | r/TeslaLounge for personal content and r/TeslaSupport for questions/help | Assist the Mods by **reporting posts and comments** which break [rules](https://www.reddit.com/r/teslamotors/wiki/rules).\n\n\n*I am a bot, and this action was performed automatically. Please [contact the moderators of this subreddit](/message/compose/?to=/r/teslamotors) if you have any questions or concerns.*', 'From the article: Earlier this week, it was reported that Tesla workers in the company\'s Buffalo, New York Autopilot facility had sent a letter to CEO Elon Musk stating their attention to unionize. Now, organizers at the same location are accusing the company of illegally terminating employees ""in retaliation for union activity and to discourage union activity,"" Bloomberg has reported. \n\nIn a filing with the US National Labor Relations Board (NLRB), the Workers United union accused Tesla of attempting to discourage its organizing activities. It has asked for a federal court injunction to ""prevent irreparable destruction of employee rights resulting from Tesla’s unlawful conduct."" Several of the employees let go had been involved in labor discussion, and one was the member of an organizing committee. \n\nEmployees involved in the campaign are in charge of labeling data for Tesla\'s Autopilot technology. The group is asking for better pay, job security and a work environment that reduces production pressures. The group previously said that Tesla engages in keystroke monitoring to see how long they spend on tasks, and shut down an internal chatroom used for airing grievances. \n\nFollowing the earlier report, Tesla issued a directive to ""protect the confidentiality, integrity and security of all Tesla business information."" However, one employee said the terminations are galvanizing, rather than intimidating workers. ""It\'s pretty clear the message they\'re sending,"" said Sara Constatino. ""And it\'s really I think backfiring on them."" The NLRB will now investigate the claims and could prosecute them before a judge if it finds merit. \n""This is a form of collective retaliation... designed to terrify everyone about potential consequences of them organizing, as well as to attempt to cull the herd,"" Workers United organizer Jaz Brisack told Bloomberg. (Engadget has contacted Tesla for comment, but doesn\'t anticipate a reply given the company no longer has a dedicated press office.)', 'This sub really hates workers.', 'Also worth considering that it could be the reverse causal mechanism. Tesla was cutting Autopilot labeling staff already because of the auto-labeling capabilities of Dojo. They may have been unionizing in an attempt to save their jobs in the first place.', '40 yr ago, they fired my fathers friend from Kodak for trying to unionize.   It happens all the time']",no content,tesla fired new york workers in retaliation for union activity complaint alleges workers at an autopilot facility recently filed a notice to unionize,['resources official tesla support wikifaq discord chat rteslalounge for personal content and rteslasupport for questionshelp assist the mods by reporting posts and comments which break rules am a bot and this action was performed automatically please contact the moderators of this subredditmessagecomposetorteslamotors if you have any questions or concerns from the article earlier this week it was reported that tesla workers in the companys buffalo new york autopilot facility had sent a letter to ceo elon musk stating their attention to unionize now organizers at the same location are accusing the company of illegally terminating employees in retaliation for union activity and to discourage union activity bloomberg has reported nnin a filing with the us national labor relations board nlrb the workers united union accused tesla of attempting to discourage its organizing activities it has asked for a federal court injunction to prevent irreparable destruction of employee rights resulting from teslas unlawful conduct several of the employees let go had been involved in labor discussion and one was the member of an organizing committee nnemployees involved in the campaign are in charge of labeling data for teslas autopilot technology the group is asking for better pay job security and a work environment that reduces production pressures the group previously said that tesla engages in keystroke monitoring to see how long they spend on tasks and shut down an internal chatroom used for airing grievances nnfollowing the earlier report tesla issued a directive to protect the confidentiality integrity and security of all tesla business information however one employee said the terminations are galvanizing rather than intimidating workers its pretty clear the message theyre sending said sara constatino and its really i think backfiring on them the nlrb will now investigate the claims and could prosecute them before a judge if it finds merit nthis is a form of collective retaliation designed to terrify everyone about potential consequences of them organizing as well as to attempt to cull the herd workers united organizer jaz brisack told bloomberg engadget has contacted tesla for comment but doesnt anticipate a reply given the company no longer has a dedicated press office this sub really hates workers also worth considering that it could be the reverse causal mechanism tesla was cutting autopilot labeling staff already because of the autolabeling capabilities of dojo they may have been unionizing in an attempt to save their jobs in the first place 40 yr ago they fired my fathers friend from kodak for trying to unionize it happens all the time'],-0.296,-0.7003,[0.4516],Negative,Positive
From Tesla Reporter Facebook page today. A “car show” ICE’ing every spot at Yorktown Heights Supercharger,5975,https://i.redd.it/tiblxrux27o31.jpg,705,1569179558,,"['[deleted]', 'If I rolled up and politely asked if someone could let me charge and they all said no, I would straight up call the police. That’s just some douchebaggery.', 'Easy fix, just roll up with Tesla’s and block them in, saying, “sorry we’ve run out of charge, if only we could get to the stations', 'If EVs parked at gas pumps they would be towed in a heartbeat. Why isn’t that happening at superchargers?\n\nEdit: turns out to be quite the shimmering question! Thanks for the silver!', 'Just for some perspective.  \nI live here around the corner.  The car “show” is called cars and coffee.  It is at a Dunkin’ Donuts.  From beginning to end, the cars are occupying the spots for 2 hours from 8-10 am on alternating Sunday’s.  \nThis does not make their actions right, as they are technically illegally parked.  BUT, as I know some of the people in attendance, they would gladly move if someone needed a charge.  This is not a motley crew of badasses who are looking to piss anyone off.  For the most parts it’s a good mix of older gentlemen and younger kids who take pride in the craftsmanship and speed of their rides.   \nThe police are generally preoccupied with the speeding and reckless driving that some prefer to partake in as they leave.  They chose this over ticketing because of the significant public safety threat.   \nAdditionally, it’s kind of fun to see my little town on the huge expense that reddit is.   Also, My 2014 Honda CR-V with Cheerios stuck in the back seat cushions was not in the car show.']",no content,from tesla reporter facebook page today a car show iceing every spot at yorktown heights supercharger,['deleted if i rolled up and politely asked if someone could let me charge and they all said no i would straight up call the police thats just some douchebaggery easy fix just roll up with teslas and block them in saying sorry weve run out of charge if only we could get to the stations if evs parked at gas pumps they would be towed in a heartbeat why isnt that happening at superchargersnnedit turns out to be quite the shimmering question thanks for the silver just for some perspective ni live here around the corner the car show is called cars and coffee it is at a dunkin donuts from beginning to end the cars are occupying the spots for 2 hours from 810 am on alternating sundays nthis does not make their actions right as they are technically illegally parked but as i know some of the people in attendance they would gladly move if someone needed a charge this is not a motley crew of badasses who are looking to piss anyone off for the most parts its a good mix of older gentlemen and younger kids who take pride in the craftsmanship and speed of their rides nthe police are generally preoccupied with the speeding and reckless driving that some prefer to partake in as they leave they chose this over ticketing because of the significant public safety threat nadditionally its kind of fun to see my little town on the huge expense that reddit is also my 2014 honda crv with cheerios stuck in the back seat cushions was not in the car show'],-0.296,0.0,[0.8426],Neutral,Positive
"Tesla is the brand with the highest depreciation of its used cars, almost 30% in one year",694,https://ev-riders.com/news/tesla-is-the-brand-with-the-highest-depreciation-of-its-used-cars/,433,1710616181,,"['As we are not a support sub, please make sure to use the proper resources if you have questions: Our Stickied Community Q&A Post, [Official Tesla Support](https://www.tesla.com/support), [r/TeslaSupport](https://www.reddit.com/r/TeslaSupport/) | [r/TeslaLounge](https://www.reddit.com/r/TeslaLounge/) personal content | [Discord Live Chat](https://discord.gg/tesla) for anything.\n\n\n*I am a bot, and this action was performed automatically. Please [contact the moderators of this subreddit](/message/compose/?to=/r/teslamotors) if you have any questions or concerns.*', '[deleted]', ""Imagine how much lower it would be if people could buy out their leases. That's probably one of the large reason why Tesla doesn't allow lease buyouts, so that they can have more control over used prices."", '""If you buy a Tesla today, I believe you are buying an appreciating asset, not a depreciating asset""', 'I want know how this compares to EV only like a nissan leaf.  I know that car has a terrible resale value.']",no content,tesla is the brand with the highest depreciation of its used cars almost 30 in one year,['as we are not a support sub please make sure to use the proper resources if you have questions our stickied community qa post official tesla support rteslasupport rteslalounge personal content discord live chat for anythingnnni am a bot and this action was performed automatically please contact the moderators of this subredditmessagecomposetorteslamotors if you have any questions or concerns deleted imagine how much lower it would be if people could buy out their leases thats probably one of the large reason why tesla doesnt allow lease buyouts so that they can have more control over used prices if you buy a tesla today i believe you are buying an appreciating asset not a depreciating asset i want know how this compares to ev only like a nissan leaf i know that car has a terrible resale value'],-0.296,0.0,[0.7324],Neutral,Positive
Tesla has informed employees to liquidate Model S and Model X inventory by the end of the month as a significant refresh now seems likely.,4324,https://electrek.co/2021/01/15/tesla-liquidate-model-s-x-inventory-refresh-nears/?fbclid=IwAR3Ed81iIIjpNc80Fu4tD1sKwlJSlHQwOFO_NMutL0C9wFi_qCL6cL5GlJ8,567,1610733138,,"['There is zero new inventory in Atlanta for S/X.', 'I tried to test drive an x today and was told that they won’t have any to test drive until March.', '[deleted]', ""Just got a Performance S in November, had waited for battery day (twice) and decided to pull the trigger. Will be nice to see a refresh finally but will have slight buyer's remorse depending on what the new features are."", 'Lucid Air is supposed to start shipping in spring right? If so I imagine this is Tesla’s best chance to go all out with the first actual competitor to the S.']",no content,tesla has informed employees to liquidate model s and model x inventory by the end of the month as a significant refresh now seems likely,['there is zero new inventory in atlanta for sx i tried to test drive an x today and was told that they wont have any to test drive until march deleted just got a performance s in november had waited for battery day twice and decided to pull the trigger will be nice to see a refresh finally but will have slight buyers remorse depending on what the new features are lucid air is supposed to start shipping in spring right if so i imagine this is teslas best chance to go all out with the first actual competitor to the s'],-0.296,0.2023,[0.8388],Positive,Positive
People would raise hell if Tesla had done this lol,3239,https://i.redd.it/dc4ybhwb2yo81.gif,408,1647993767,,"['Is something wrong with your vehicle or need help? Click [here](https://www.reddit.com/r/teslamotors/comments/t4isha/technical_support_service_support_vehicle/), use our stickied support thread, see r/TeslaLounge, [Discord](https://discord.gg/tesla), hit up [Tesla Support](https://www.tesla.com/support), or use the Service section in the Tesla app.  Help the [Mods](https://www.reddit.com/r/teslamotors/wiki/rules#wiki_special_note_from_the_moderators) by being respectful, and by reporting posts + comments which break the [Rules](https://www.reddit.com/r/teslamotors/wiki/rules).  Thanks for being awesome!\n\n\n*I am a bot, and this action was performed automatically. Please [contact the moderators of this subreddit](/message/compose/?to=/r/teslamotors) if you have any questions or concerns.*', ""Could be worse. If you've ever seen a Porsche with no options you know what I mean."", 'Unless that is actually a software unlock, they should have put a blank switch in there instead.', '[deleted]', 'This is like me in the Toyota Sienna I rented over the weekend. A new base model (LE). It had a navigation button on the infotainment but said it hadn’t been purchased. Okay whatever. Give me my CarPlay. But it didn’t have CarPlay either. Complete piece of shit infotainment 😆']",no content,people would raise hell if tesla had done this lol,['is something wrong with your vehicle or need help click here use our stickied support thread see rteslalounge discord hit up tesla support or use the service section in the tesla app help the mods by being respectful and by reporting posts comments which break the rules thanks for being awesomennni am a bot and this action was performed automatically please contact the moderators of this subredditmessagecomposetorteslamotors if you have any questions or concerns could be worse if youve ever seen a porsche with no options you know what i mean unless that is actually a software unlock they should have put a blank switch in there instead deleted this is like me in the toyota sienna i rented over the weekend a new base model le it had a navigation button on the infotainment but said it hadnt been purchased okay whatever give me my carplay but it didnt have carplay either complete piece of shit infotainment'],-0.296,-0.3291,[-0.4017],Negative,Negative
What type of Tesla is this?,4050,https://i.redd.it/bfrlcp3bqrs61.jpg,527,1618244534,,"['Original roadster', 'Original Roadster. 110 of these were delivered in NL.', 'one that is dutch AF.  love the relief license plates they have there...  any car owner worth his pepper has that style', ""The only production car to travel beyond Mars' orbit."", 'Only 2499 left on earth.....1 in space. Lol']",no content,what type of tesla is this,['original roadster original roadster 110 of these were delivered in nl one that is dutch af love the relief license plates they have there any car owner worth his pepper has that style the only production car to travel beyond mars orbit only 2499 left on earth1 in space lol'],-0.296,0.0,[0.9393],Neutral,Positive
Tesla ASS (Actually Smart Summon) Roundabout Test,620,https://youtu.be/wmZ7oHzRfvk?si=h-4AyP3ixQ6JKsx1,190,1725365605,,"['Let’s see it at a Costco parking lot.', 'Was looking forward to the first tests. Now I want a more busy parking lot…', ""I wonder what's the furthest distance it will respond from you?"", 'Law: Both hands on the wheel, cellphone handsfree only while driving.\n\nTesla: No driver required in the car but driver needs to hold phone in the hands.', 'Is this a car software update or phone app update?']",no content,tesla ass actually smart summon roundabout test,['lets see it at a costco parking lot was looking forward to the first tests now i want a more busy parking lot i wonder whats the furthest distance it will respond from you law both hands on the wheel cellphone handsfree only while drivingnntesla no driver required in the car but driver needs to hold phone in the hands is this a car software update or phone app update'],-0.296,-0.2023,[-0.1154],Negative,Negative
