title,score,url,num_comments,created_utc,selftext,comments,cleaned_selftext,cleaned_title,cleaned_comments,selftext_sentiment,title_sentiment,comments_sentiment,title_sentiment_category,comments_sentiment_category
Tesla will hold a shareholder vote to incorporate in Texas after Delaware pay snub,1112,https://www.cnbc.com/2024/02/01/elon-musk-tesla-will-hold-a-shareholder-vote-to-incorporate-in-texas.html,601,1706796612,,"[""If someone writes up a proper, sourced, pros/cons list of moving Tesla's incorporation out of Delaware to Texas, I'll edit this comment with a link to said comment.\n\nNote that I will read through the comment, and the sourced material within it.\n\nNeeds to be primary, reputable, sources.  No opinion pieces and such."", 'From the article: Elon Musk said late Wednesday that Tesla will hold a shareholder vote on whether to transfer the electric carmaker’s state of incorporation to Texas.\n\nThe billionaire asked his followers via a straw poll on X, formerly Twitter, whether Tesla should change the state where it is incorporated to Texas, where its physical headquarters are. More than 80% of those who voted said yes. Polls on the social media platform are informal and not comparable to professional public opinion research.\n\nAfter the poll, Musk said Tesla will “will move immediately to hold a shareholder vote to transfer state of incorporation to Texas.” Musk will likely have to seek approval from the Tesla board to enact such a move. Tesla is currently incorporated in Delaware.\n\nMusk’s X post comes after a judge in Delaware voided the $56 billion pay package for the Tesla CEO granted in 2018, the largest compensation plan in public corporate history. Chancery Court Chancellor Kathaleen McCormick ruled that the company’s board of directors failed to prove “that the compensation plan was fair” or show much evidence that they had even negotiated with Musk.', 'Any business types want to actually list off some pros and cons of each state for incorporating there? The article lacks any substance.', 'After watching Succession, I just imagine the camera panning and zooming in on various people’s faces when these decisions are being discussed amongst Elon and executives.', 'I’m an investor and don’t understand why he needs to be a little bitch and consult a twitter poll. You’re the chief executive. Sack up and do what needs to be done you fucking sycophant.']",no content,tesla will hold a shareholder vote to incorporate in texas after delaware pay snub,['if someone writes up a proper sourced proscons list of moving teslas incorporation out of delaware to texas ill edit this comment with a link to said commentnnnote that i will read through the comment and the sourced material within itnnneeds to be primary reputable sources no opinion pieces and such from the article elon musk said late wednesday that tesla will hold a shareholder vote on whether to transfer the electric carmakers state of incorporation to texasnnthe billionaire asked his followers via a straw poll on x formerly twitter whether tesla should change the state where it is incorporated to texas where its physical headquarters are more than 80 of those who voted said yes polls on the social media platform are informal and not comparable to professional public opinion researchnnafter the poll musk said tesla will will move immediately to hold a shareholder vote to transfer state of incorporation to texas musk will likely have to seek approval from the tesla board to enact such a move tesla is currently incorporated in delawarennmusks x post comes after a judge in delaware voided the 56 billion pay package for the tesla ceo granted in 2018 the largest compensation plan in public corporate history chancery court chancellor kathaleen mccormick ruled that the companys board of directors failed to prove that the compensation plan was fair or show much evidence that they had even negotiated with musk any business types want to actually list off some pros and cons of each state for incorporating there the article lacks any substance after watching succession i just imagine the camera panning and zooming in on various peoples faces when these decisions are being discussed amongst elon and executives im an investor and dont understand why he needs to be a little bitch and consult a twitter poll youre the chief executive sack up and do what needs to be done you fucking sycophant'],-0.296,-0.4939,[-0.2516],Negative,Negative
Elon Musk: Both Tesla shareholder resolutions are currently passing by wide margins!,640,https://twitter.com/elonmusk/status/1801084780035154058,680,1718249086,,"['[First and foremost, please read r/TeslaMotors - A New Dawn](https://www.reddit.com/r/teslamotors/comments/1c49sv0/rteslamotors_a_new_dawn/)\n\n\nAs we are not a support sub, please make sure to use the proper resources if you have questions: [Official Tesla Support](https://www.tesla.com/support), [r/TeslaSupport](https://www.reddit.com/r/TeslaSupport/) | [r/TeslaLounge](https://www.reddit.com/r/TeslaLounge/) personal content | [Discord Live Chat](https://discord.gg/tesla) for anything.\n\n\n*I am a bot, and this action was performed automatically. Please [contact the moderators of this subreddit](/message/compose/?to=/r/teslamotors) if you have any questions or concerns.*', 'Redditors find out  reddit is not real life', ""But wait? All the comments on reddit indicated it was going to fail ?!?!?\n\nIts as if... the majority of detractors aren't actually shareholders???"", 'Ok now can we stop with the damn posts about it?', 'Reality just took a giant cosmic dump on the Redditor collective 🤣']",no content,elon musk both tesla shareholder resolutions are currently passing by wide margins,['first and foremost please read rteslamotors a new dawn we are not a support sub please make sure to use the proper resources if you have questions official tesla support rteslasupport rteslalounge personal content discord live chat for anythingnnni am a bot and this action was performed automatically please contact the moderators of this subredditmessagecomposetorteslamotors if you have any questions or concerns redditors find out reddit is not real life but wait all the comments on reddit indicated it was going to fail nnits as if the majority of detractors arent actually shareholders ok now can we stop with the damn posts about it reality just took a giant cosmic dump on the redditor collective'],-0.296,0.0,[-0.9308],Neutral,Negative
Texas Wants To Charge Tesla & Other EV Owners ~$400 In Annual Fees For Owning An EV,5457,https://cleantechnica.com/2021/05/14/texas-wants-to-charge-tesla-other-ev-owners-400-in-annual-fees-for-owning-an-ev/,1102,1621109658,,"['[deleted]', 'Fortunately a comparable bill, HB209 in Utah died in the last session this year.\n\nhttp://le.utah.gov/~2021/bills/static/HB0209.html', 'A regular ICE vehicle owner spends nowhere near this amount of money in gas taxes.  150 to 200 dollars at best.', 'I don’t have a problem with paying our fair share of road taxes but a flat fee is nonsensical. Base it on mileage or something. Get rid of fuel taxes and apply this road tax evenly across the board.', 'Easy, proof of mileage when to reregister your tags.  Most states require that every year or two.  Option #2 is when excise tax is paid.  Option #3. -  if annual inspections are required, mileage is entered in, and a bill is generated.']",no content,texas wants to charge tesla other ev owners 400 in annual fees for owning an ev,['deleted fortunately a comparable bill hb209 in utah died in the last session this yearnn a regular ice vehicle owner spends nowhere near this amount of money in gas taxes 150 to 200 dollars at best i dont have a problem with paying our fair share of road taxes but a flat fee is nonsensical base it on mileage or something get rid of fuel taxes and apply this road tax evenly across the board easy proof of mileage when to reregister your tags most states require that every year or two option 2 is when excise tax is paid option 3 if annual inspections are required mileage is entered in and a bill is generated'],-0.296,0.0,[0.7923],Neutral,Positive
New Tesla Model 3 - what's changed? - CARWOW Video w/ New Model 3,1403,https://youtu.be/gQ6zIHHMlSs?si=944esQAU2dfKgZm2,852,1693526935,,"['Standard range 346 miles (not epa rated yet)\n\nLong range 423 miles (not epa rated yet)\n\nimproved suspension\n\n8% efficiency improvement\n\n30% improvement to reduced road / ambient noise\n\nrear screen like model S plaid\n\nventilated front seats\n\ntraditional horn\n\nremoved stalks\n\nmore responsive and brighter screen\n\nimproved bluetooth and wifi\n\nupgraded ventilation / AC system (more controls)\n\n17 speakers, instead of 14 like prior model\n\nabout the same price', 'I’m glad Tesla finally added ambient lightning, ventilated seats, and a rear screen for controls. Those 3 are the things I wish my M3 had since I bought it.', ""Where's the announcement outside this Carwow video? Was it posted early? Should we download it lol \n \nEd: Ah yeah I see it going global now, for English the Australian site is up"", 'Awesome changes except for the removal of steering wheel stalks.', 'Can’t wait for the model y upgrade 😍']",no content,new tesla model 3 whats changed carwow video w new model 3,['standard range 346 miles not epa rated yetnnlong range 423 miles not epa rated yetnnimproved suspensionnn8 efficiency improvementnn30 improvement to reduced road ambient noisennrear screen like model s plaidnnventilated front seatsnntraditional hornnnremoved stalksnnmore responsive and brighter screennnimproved bluetooth and wifinnupgraded ventilation ac system more controlsnn17 speakers instead of 14 like prior modelnnabout the same price im glad tesla finally added ambient lightning ventilated seats and a rear screen for controls those 3 are the things i wish my m3 had since i bought it wheres the announcement outside this carwow video was it posted early should we download it lol n ned ah yeah i see it going global now for english the australian site is up awesome changes except for the removal of steering wheel stalks cant wait for the model y upgrade'],-0.296,0.0,[0.9806],Neutral,Positive
If you’re in California your tesla will be late for delivery.,9942,https://i.redd.it/p60r0tbzqwm71.jpg,455,1631380734,,"['If help is needed, use our stickied support thread, or [Tesla Support](https://www.tesla.com/support).  Everyone, please read our [Rules](https://www.reddit.com/r/teslamotors/wiki/rules) and a [note](https://www.reddit.com/r/teslamotors/wiki/rules#wiki_special_note_from_the_moderators) from the Mods. Be respectful, please remember to Report (it helps Mods immensely), and comment with a focus on moving discussion forward.  \n\n\n*I am a bot, and this action was performed automatically. Please [contact the moderators of this subreddit](/message/compose/?to=/r/teslamotors) if you have any questions or concerns.*', 'Looks like the operator did a good job strapping in those cars', '“Ten Tesla’s equipped with autopilot involved in accidents in a single day”', 'Oh man…. A semi with PowerWalls tipped over today, now this……', 'first the powerwalls, now this? what is happening']",no content,if youre in california your tesla will be late for delivery,['if help is needed use our stickied support thread or tesla support everyone please read our rules and a note from the mods be respectful please remember to report it helps mods immensely and comment with a focus on moving discussion forward nnni am a bot and this action was performed automatically please contact the moderators of this subredditmessagecomposetorteslamotors if you have any questions or concerns looks like the operator did a good job strapping in those cars ten teslas equipped with autopilot involved in accidents in a single day oh man a semi with powerwalls tipped over today now this first the powerwalls now this what is happening'],-0.296,0.0,[0.967],Neutral,Positive
Elon on X: “Tesla Robotaxi unveil on 8/8”,731,https://x.com/elonmusk/status/1776351450542768368?s=46,866,1712350636,,"['As we are not a support sub, please make sure to use the proper resources if you have questions: [Official Tesla Support](https://www.tesla.com/support), [r/TeslaSupport](https://www.reddit.com/r/TeslaSupport/) | [r/TeslaLounge](https://www.reddit.com/r/TeslaLounge/) personal content | [Discord Live Chat](https://discord.gg/tesla) for anything.\n\n\n*I am a bot, and this action was performed automatically. Please [contact the moderators of this subreddit](/message/compose/?to=/r/teslamotors) if you have any questions or concerns.*', 'Why do I feel like the engineers just learned about this right now haha.', 'Hmm...no year included.', 'So I guess the engineers should start working on it!', 'This comment section will be entertaining.']",no content,elon on x tesla robotaxi unveil on 88,['as we are not a support sub please make sure to use the proper resources if you have questions official tesla support rteslasupport rteslalounge personal content discord live chat for anythingnnni am a bot and this action was performed automatically please contact the moderators of this subredditmessagecomposetorteslamotors if you have any questions or concerns why do i feel like the engineers just learned about this right now haha hmmno year included so i guess the engineers should start working on it this comment section will be entertaining'],-0.296,0.0,[0.901],Neutral,Positive
Tesla enabling free supercharging for anyone in Hurricane Florence’s path,20018,https://i.redd.it/hjo6ykhn0tl11.jpg,1277,1536756533,,"[""Now if only they'd allow me to hook up an inverter to my car in case I need emergency power!"", ""That's really cool.\n\nMeanwhile, Verizon throttles data for SC and suggests everyone upgrade.  /s"", ""Because there is some misinformation here, this should clear up some things.\n\n- Tesla previously offered battery packs that were software-limited larger packs, so you could get into a cheaper Tesla with less range, but had the same performance specs.\n- Free Supercharging is for select Model S, Model X and Performance Model 3's with an owners referral at purchase.  Non-Performance Model 3's are pay-per-use Supercharging.\n- Supercharging fills up your battery approx 170 miles in 30 min and is intended for long-distance travel.  Learn more [here](https://tesla.com/charging) and [here](https://tesla.com/trips).\n- This update (what this post is referring to) enables free supercharging for all cars in the hurricane’s path, along with temporary pack software upgrades."", 'Can someone please explain; how can Tesla remotely, digitally, increase the car’s battery capacity? I don’t get it.', 'The free supper charging for all is super nice of them.  Also I wished they had a storm response team for the network like other major industries like the gas companies do.  We need the charger network to be up and safe ASAP pre and post storm for all those in the evacuation order area.  ']",no content,tesla enabling free supercharging for anyone in hurricane florences path,['now if only theyd allow me to hook up an inverter to my car in case i need emergency power thats really coolnnmeanwhile verizon throttles data for sc and suggests everyone upgrade s because there is some misinformation here this should clear up some thingsnn tesla previously offered battery packs that were softwarelimited larger packs so you could get into a cheaper tesla with less range but had the same performance specsn free supercharging is for select model s model x and performance model 3s with an owners referral at purchase nonperformance model 3s are payperuse superchargingn supercharging fills up your battery approx 170 miles in 30 min and is intended for longdistance travel learn more here and here this update what this post is referring to enables free supercharging for all cars in the hurricanes path along with temporary pack software upgrades can someone please explain how can tesla remotely digitally increase the cars battery capacity i dont get it the free supper charging for all is super nice of them also i wished they had a storm response team for the network like other major industries like the gas companies do we need the charger network to be up and safe asap pre and post storm for all those in the evacuation order area'],-0.296,0.5106,[0.9911],Positive,Positive
"The Tesla first responders manual is a must read for all owners. Read it before you are involved in an accident, not after like us. ",1253,https://www.tesla.com/firstresponders,208,1719750300,"My spouse was recently in a high speed accident. Immediately after the accident, she tried to break the glass but realized that was not possible (The front windows have laminated glass, but the back don't).

Also, after the car was towed to this salvage yard, I found it very difficult to get all of our belongings from the frunk and the glove box. 

If you have never looked at it before, so much important information that you will want to commit to memory is located in the first responders manual of your Tesla. Do it before you are ever in an accident, not after like we did. 

https://www.tesla.com/firstresponders","['\n#No shame Sunday on the 30th! \n\nIf you make Tesla/EV products or apps. This is your time to come to the sub and promote yourself. The way this works is you make a post and if it does not show up right away, reach out to modmail and a mod will approve it to make sure it shows up. We will keep automod turned on so the sub doesn\'t get hit with spam. Please keep in mind that this is only for 6/30/2024. On Monday we will go back to normal. Each post will have a flair as ""No shame Sunday"" for those that want to filter it out.\n\nIf you are a seller or app dev and want a flair next to your username please let us know via modmail.\n\nIf you are a 3rd party app dev and want your link in the top menu of the sub under ""3rd party apps"" please reach out to modmail.\n\n----------\n\nAs we are not a support sub, please make sure to use the proper resources if you have questions: [Official Tesla Support](https://www.tesla.com/support), [r/TeslaSupport](https://www.reddit.com/r/TeslaSupport/) | [r/TeslaLounge](https://www.reddit.com/r/TeslaLounge/) personal content | [Discord Live Chat](https://discord.gg/tesla) for anything.\n\n\n*I am a bot, and this action was performed automatically. Please [contact the moderators of this subreddit](/message/compose/?to=/r/teslamotors) if you have any questions or concerns.*', 'As a firefighter, I appreciate this article. I’ll pass along to our training division.', 'Thanks. I need to move my glass breaker to the armrest. If the screen/power is dead, hard to access the glovebox.', 'https://preview.redd.it/pnhcqlzkaq9d1.jpeg?width=1290&format=pjpg&auto=webp&s=53a89e83fe08a1ec6ab44efc90b71aafc5d30fda\n\nThis was news to me. Thank you.\n\nShort version: in a MY (and maybe other models) by popping open the tow hook location there are two wires that when you connect an external 12v power supply to, it will pop the frunk open.', 'Don\'t assume that this information has made its way to your local Fire Department/EMS. There\'s still residual ""folk wisdom"" about EVs in many departments. A friendly email to your local Fire Chief with this link may lead to better informed EMS response.']",my spouse was recently in a high speed accident immediately after the accident she tried to break the glass but realized that was not possible the front windows have laminated glass but the back dontalso after the car was towed to this salvage yard i found it very difficult to get all of our belongings from the frunk and the glove box if you have never looked at it before so much important information that you will want to commit to memory is located in the first responders manual of your tesla do it before you are ever in an accident not after like we did,the tesla first responders manual is a must read for all owners read it before you are involved in an accident not after like us,['nno shame sunday on the 30th nnif you make teslaev products or apps this is your time to come to the sub and promote yourself the way this works is you make a post and if it does not show up right away reach out to modmail and a mod will approve it to make sure it shows up we will keep automod turned on so the sub doesnt get hit with spam please keep in mind that this is only for 6302024 on monday we will go back to normal each post will have a flair as no shame sunday for those that want to filter it outnnif you are a seller or app dev and want a flair next to your username please let us know via modmailnnif you are a 3rd party app dev and want your link in the top menu of the sub under 3rd party apps please reach out to modmailnnnnas we are not a support sub please make sure to use the proper resources if you have questions official tesla support rteslasupport rteslalounge personal content discord live chat for anythingnnni am a bot and this action was performed automatically please contact the moderators of this subredditmessagecomposetorteslamotors if you have any questions or concerns as a firefighter i appreciate this article ill pass along to our training division thanks i need to move my glass breaker to the armrest if the screenpower is dead hard to access the glovebox was news to me thank younnshort version in a my and maybe other models by popping open the tow hook location there are two wires that when you connect an external 12v power supply to it will pop the frunk open dont assume that this information has made its way to your local fire departmentems theres still residual folk wisdom about evs in many departments a friendly email to your local fire chief with this link may lead to better informed ems response'],-0.8288,-0.6381,[0.9719],Negative,Positive
Tesla delivers N95 masks to UCLA Health,22268,https://i.imgur.com/K0f4SAi.jpg,612,1584905220,,"['With WA state out as well, it makes me wonder how many Boeing is sitting on.', ""What's the story here? Is Tesla donating some that were in their inventory, maybe originally for paint shop workers?"", 'Elon Mask', 'State of New York zooming in on the ‘Need More’ sign.', 'Wonder what it says under ""Need More? Contact...""']",no content,tesla delivers n95 masks to ucla health,['with wa state out as well it makes me wonder how many boeing is sitting on whats the story here is tesla donating some that were in their inventory maybe originally for paint shop workers elon mask state of new york zooming in on the need more sign wonder what it says under need more contact'],-0.296,0.0,[0.2732],Neutral,Positive
Tesla's Summon feature was very useful today...,49178,https://gfycat.com/ReliableSecretJunebug,1048,1516835615,,"['That’s damn cool... especially with the door opening as you approach. You half expect Jarvis to be like “Good evening sir, we had a little rain in your absence, I trust you remained dry” with that British accent lol. ', 'They say that necessity is the mother of invention... I say that laziness is\n\nTesla knows what we really want lol ', 'Was this sped up? I thought summon takes of time a bit to move forward that far.', 'If I owned this, I’d forget that I had the feature and would have still tried to super jump over the puddle and hop into the car like a spy hopping through laser trip-wire.', 'Oh yeah? **My** car gurgles when I turn it on. Beat that. \n\n:(']",no content,teslas summon feature was very useful today,['thats damn cool especially with the door opening as you approach you half expect jarvis to be like good evening sir we had a little rain in your absence i trust you remained dry with that british accent lol they say that necessity is the mother of invention i say that laziness isnntesla knows what we really want lol was this sped up i thought summon takes of time a bit to move forward that far if i owned this id forget that i had the feature and would have still tried to super jump over the puddle and hop into the car like a spy hopping through laser tripwire oh yeah my car gurgles when i turn it on beat that nn'],-0.296,0.4927,[0.966],Positive,Positive
