title,score,url,num_comments,created_utc,selftext,comments,cleaned_selftext,cleaned_title,cleaned_comments,selftext_sentiment,title_sentiment,comments_sentiment,title_sentiment_category,comments_sentiment_category
The average price of used Tesla continues to decline.  Advice Needed: Is it worth to buy used Tesla?,1016,https://i.redd.it/to1fiiyibcqc1.jpeg,626,1711311441,,"['This chart combined with the fact that data is showing the degradation with batteries is not as harsh as initially thought would make me say yes. Especially if you can charge at home.', 'I got a 21 Model 3 for 15k after the used ev credit the other day.', 'Tesla offered me about 12k for my M3 with FSD. I can get more on the used market, but honestly, a used M3 might be the best deal on the market today. Buy it for 20k and drive it until the wheels fall off. I’ve put 60k miles on mine, and it still drives like new. I don’t even include home charging in the budget and maintenance is still nonexistent for me.', 'The used price is falling because the new price is falling. It’s possible to get a brand new Model Y for around $32k after incentives and discounts rn. Check inventory and see if you qualify for the $7,500 tax incentive, which is point of sale this year. Super nice.', 'I would wait as more people trade in the old Teslas for new ones.  Should keep dropping the used prices with the flood of used inventory every quarter.']",no content,the average price of used tesla continues to decline advice needed is it worth to buy used tesla,['this chart combined with the fact that data is showing the degradation with batteries is not as harsh as initially thought would make me say yes especially if you can charge at home i got a 21 model 3 for 15k after the used ev credit the other day tesla offered me about 12k for my m3 with fsd i can get more on the used market but honestly a used m3 might be the best deal on the market today buy it for 20k and drive it until the wheels fall off ive put 60k miles on mine and it still drives like new i dont even include home charging in the budget and maintenance is still nonexistent for me the used price is falling because the new price is falling its possible to get a brand new model y for around 32k after incentives and discounts rn check inventory and see if you qualify for the 7500 tax incentive which is point of sale this year super nice i would wait as more people trade in the old teslas for new ones should keep dropping the used prices with the flood of used inventory every quarter'],-0.296,0.2263,[0.9829],Positive,Positive
"Tesla CEO Elon Musk could leave if $56 billion pay package not approved, shareholders warned",12112,https://www.theverge.com/2024/6/6/24173064/tesla-board-chair-warn-elon-musk-leave-pay-shareholders,2560,1717702900,,"['[First and foremost, please read r/TeslaMotors - A New Dawn](https://www.reddit.com/r/teslamotors/comments/1c49sv0/rteslamotors_a_new_dawn/)\n\n\nAs we are not a support sub, please make sure to use the proper resources if you have questions: [Official Tesla Support](https://www.tesla.com/support), [r/TeslaSupport](https://www.reddit.com/r/TeslaSupport/) | [r/TeslaLounge](https://www.reddit.com/r/TeslaLounge/) personal content | [Discord Live Chat](https://discord.gg/tesla) for anything.\n\n\n*I am a bot, and this action was performed automatically. Please [contact the moderators of this subreddit](/message/compose/?to=/r/teslamotors) if you have any questions or concerns.*', 'Already voted.\n\n![gif](giphy|YYfEjWVqZ6NDG)', ""don't threaten me with a good time"", 'This is a board member warning about it and not just some shareholders.', '![gif](giphy|T7j5439wv9iq4|downsized)']",no content,tesla ceo elon musk could leave if 56 billion pay package not approved shareholders warned,['first and foremost please read rteslamotors a new dawn we are not a support sub please make sure to use the proper resources if you have questions official tesla support rteslasupport rteslalounge personal content discord live chat for anythingnnni am a bot and this action was performed automatically please contact the moderators of this subredditmessagecomposetorteslamotors if you have any questions or concerns already votednngifgiphyyyfejwvqz6ndg dont threaten me with a good time this is a board member warning about it and not just some shareholders gifgiphyt7j5439wv9iq4downsized'],-0.296,-0.2773,[0.8237],Negative,Positive
Tesla billionaire investor votes against restoring Elon Musk’s $50 billion pay package,18275,https://www.forbes.com.au/news/innovation/teslas-top-retail-investor-votes-against-restoring-elon-musks-50-billion-pay-package/,1115,1715812515,,"['[First and foremost, please read r/TeslaMotors - A New Dawn](https://www.reddit.com/r/teslamotors/comments/1c49sv0/rteslamotors_a_new_dawn/)\n\n\nAs we are not a support sub, please make sure to use the proper resources if you have questions: [Official Tesla Support](https://www.tesla.com/support), [r/TeslaSupport](https://www.reddit.com/r/TeslaSupport/) | [r/TeslaLounge](https://www.reddit.com/r/TeslaLounge/) personal content | [Discord Live Chat](https://discord.gg/tesla) for anything.\n\n\n*I am a bot, and this action was performed automatically. Please [contact the moderators of this subreddit](/message/compose/?to=/r/teslamotors) if you have any questions or concerns.*', 'Do we get the final results on June 13? If not how long after the investor meeting should we expect to receive final results?', ""Leo Koguan's percentage ownership in Tesla is approximately 0.9% as of May 2024, based on his reported ownership of about 27.6 million shares out of the 3,186,000,000 shares outstanding."", ""Imagine if Musk doesn't get his stock options, and makes it his mission to do as much damage as possible."", 'remeber that time when he spent 44 billion on twitter then called it X, changed the domain name, fired some people and lost 31.5 BILLION $$$$$ no... that was less then 2 years ago! \n\nX is for porn!']",no content,tesla billionaire investor votes against restoring elon musks 50 billion pay package,['first and foremost please read rteslamotors a new dawn we are not a support sub please make sure to use the proper resources if you have questions official tesla support rteslasupport rteslalounge personal content discord live chat for anythingnnni am a bot and this action was performed automatically please contact the moderators of this subredditmessagecomposetorteslamotors if you have any questions or concerns do we get the final results on june 13 if not how long after the investor meeting should we expect to receive final results leo koguans percentage ownership in tesla is approximately 09 as of may 2024 based on his reported ownership of about 276 million shares out of the 3186000000 shares outstanding imagine if musk doesnt get his stock options and makes it his mission to do as much damage as possible remeber that time when he spent 44 billion on twitter then called it x changed the domain name fired some people and lost 315 billion no that was less then 2 years ago nnx is for porn'],-0.296,0.2023,[0.4664],Positive,Positive
Elon Musk confirms his threat: give me 25% of Tesla or you don't get AI and robotics,9187,https://electrek.co/2024/05/20/elon-musk-confirms-threat-give-me-25-of-tesla-or-no-ai-robotics/,2025,1716223051,,"['[First and foremost, please read r/TeslaMotors - A New Dawn](https://www.reddit.com/r/teslamotors/comments/1c49sv0/rteslamotors_a_new_dawn/)\n\n\nAs we are not a support sub, please make sure to use the proper resources if you have questions: [Official Tesla Support](https://www.tesla.com/support), [r/TeslaSupport](https://www.reddit.com/r/TeslaSupport/) | [r/TeslaLounge](https://www.reddit.com/r/TeslaLounge/) personal content | [Discord Live Chat](https://discord.gg/tesla) for anything.\n\n\n*I am a bot, and this action was performed automatically. Please [contact the moderators of this subreddit](/message/compose/?to=/r/teslamotors) if you have any questions or concerns.*', 'Shouldn’t have sold so much of the stock to buy twitter then 🤷\u200d♀️', '&#x200B;\n\nhttps://i.redd.it/5hvdt6ga6m1d1.gif', 'I feel like Tesla is far from being the company I loved, the one focused on accelerating the advent of EVs and clean energy.', 'Tesla needs a new CEO']",no content,elon musk confirms his threat give me 25 of tesla or you dont get ai and robotics,['first and foremost please read rteslamotors a new dawn we are not a support sub please make sure to use the proper resources if you have questions official tesla support rteslasupport rteslalounge personal content discord live chat for anythingnnni am a bot and this action was performed automatically please contact the moderators of this subredditmessagecomposetorteslamotors if you have any questions or concerns shouldnt have sold so much of the stock to buy twitter then u200d x200bnn i feel like tesla is far from being the company i loved the one focused on accelerating the advent of evs and clean energy tesla needs a new ceo'],-0.296,-0.5267,[0.9568],Negative,Positive
"Tesla shareholders should reject Elon Musk’s US$56-billion pay package, Glass Lewis says",5475,https://financialpost.com/commodities/energy/electric-vehicles/tesla-shareholders-elon-musk-package-glass-lewis,1048,1716910038,,"['[First and foremost, please read r/TeslaMotors - A New Dawn](https://www.reddit.com/r/teslamotors/comments/1c49sv0/rteslamotors_a_new_dawn/)\n\n\nAs we are not a support sub, please make sure to use the proper resources if you have questions: [Official Tesla Support](https://www.tesla.com/support), [r/TeslaSupport](https://www.reddit.com/r/TeslaSupport/) | [r/TeslaLounge](https://www.reddit.com/r/TeslaLounge/) personal content | [Discord Live Chat](https://discord.gg/tesla) for anything.\n\n\n*I am a bot, and this action was performed automatically. Please [contact the moderators of this subreddit](/message/compose/?to=/r/teslamotors) if you have any questions or concerns.*', ""This must be one of the most reposted articles on the pay package globally. Not sure why but I've been seeing this article more than anything else in the past days"", ""I rejected it, that's what he gets for firing me 🙏"", 'Him firing the entire supercharger team was the dumbest move imaginable. Stock price dropped and it outraged the true believers.', 'Rejecting his pay offer is the only reason I voted']",no content,tesla shareholders should reject elon musks us56billion pay package glass lewis says,['first and foremost please read rteslamotors a new dawn we are not a support sub please make sure to use the proper resources if you have questions official tesla support rteslasupport rteslalounge personal content discord live chat for anythingnnni am a bot and this action was performed automatically please contact the moderators of this subredditmessagecomposetorteslamotors if you have any questions or concerns this must be one of the most reposted articles on the pay package globally not sure why but ive been seeing this article more than anything else in the past days i rejected it thats what he gets for firing me him firing the entire supercharger team was the dumbest move imaginable stock price dropped and it outraged the true believers rejecting his pay offer is the only reason i voted'],-0.296,-0.4767,[-0.966],Negative,Negative
Tesla Cybertruck Pricing,5059,https://i.redd.it/zzdprzkosj3c1.png,2697,1701377464,,"['As we are not a support sub, please make sure to use the proper resources if you have questions: Our Stickied Community Q&A Post, [Official Tesla Support](https://www.tesla.com/support), [r/TeslaSupport](https://www.reddit.com/r/TeslaSupport/) | [r/TeslaLounge](https://www.reddit.com/r/TeslaLounge/) personal content | [Discord Live Chat](https://discord.gg/tesla) for anything.\n\n\n*I am a bot, and this action was performed automatically. Please [contact the moderators of this subreddit](/message/compose/?to=/r/teslamotors) if you have any questions or concerns.*', 'For reference, here are the prices back when it was launched in 2019.\n\n$39,900 - Single Motor RWD  \n$49,900 - Dual Motor AWD  \n$69,900 - Tri Motor AWD', 'https://preview.redd.it/uvyecqxwtj3c1.jpeg?width=1179&format=pjpg&auto=webp&s=bccfe96ef12197cde9e06d3e260d976055b54151\n\nIf you scroll to the spec part there is another range with the +range extender option????', 'Here are the real purchase prices without the ""probable savings"":\n\n|Car|Price|Range|0-60|\n|:-|:-|:-|:-|\n|Cybertruck RWD|$60,990|250|6.5|\n|Cybertruck AWD|$79,990|340|4.1|\n|Cyberbeast|$99,990|320|2.6|\n\nProbable savings: $3600 gas savings for each model + $7500 tax credit for RWD and AWD models.\n\nFor comparison, here are a few comparable Rivian R1T trims:\n\n|Car|Price|Range|0-60|\n|:-|:-|:-|:-|\n|AWD Standard Pack|$73,000|270|4.5|\n|AWD Large Pack|$79,000|352|4.5|\n|Performance AWD Large Pack|$84,000|352|3.5|\n|Quad-Motor AWD Large Pack|$87,000|328|3.0|\n\n**Edit:** [**More comparisons, including with the F-150 Lightning & other Rivian trims**](https://evtable.com/news/2023/11/tesla-cybertruck-vs-rivian-r1t-vs-ford-f150-lightning)', '[removed]']",no content,tesla cybertruck pricing,['as we are not a support sub please make sure to use the proper resources if you have questions our stickied community qa post official tesla support rteslasupport rteslalounge personal content discord live chat for anythingnnni am a bot and this action was performed automatically please contact the moderators of this subredditmessagecomposetorteslamotors if you have any questions or concerns for reference here are the prices back when it was launched in 2019nn39900 single motor rwd n49900 dual motor awd n69900 tri motor awd you scroll to the spec part there is another range with the range extender option here are the real purchase prices without the probable savingsnncarpricerange060nncybertruck rwd6099025065ncybertruck awd7999034041ncyberbeast9999032026nnprobable savings 3600 gas savings for each model 7500 tax credit for rwd and awd modelsnnfor comparison here are a few comparable rivian r1t trimsnncarpricerange060nnawd standard pack7300027045nawd large pack7900035245nperformance awd large pack8400035235nquadmotor awd large pack8700032830nnedit more comparisons including with the f150 lightning other rivian trims removed'],-0.296,0.0,[0.7745],Neutral,Positive
Elon Musk ordered Nvidia to ship thousands of AI chips reserved for Tesla to X and xAI,2956,https://www.cnbc.com/2024/06/04/elon-musk-told-nvidia-to-ship-ai-chips-reserved-for-tesla-to-x-xai.html,776,1717508250,,"['[First and foremost, please read r/TeslaMotors - A New Dawn](https://www.reddit.com/r/teslamotors/comments/1c49sv0/rteslamotors_a_new_dawn/)\n\n\nAs we are not a support sub, please make sure to use the proper resources if you have questions: [Official Tesla Support](https://www.tesla.com/support), [r/TeslaSupport](https://www.reddit.com/r/TeslaSupport/) | [r/TeslaLounge](https://www.reddit.com/r/TeslaLounge/) personal content | [Discord Live Chat](https://discord.gg/tesla) for anything.\n\n\n*I am a bot, and this action was performed automatically. Please [contact the moderators of this subreddit](/message/compose/?to=/r/teslamotors) if you have any questions or concerns.*', 'I can hear the securities class action already.', ""It's obvious that he hasn't had the best interests for Tesla in mind. \n\nIt's time for him to go."", ""Elon's explanation: https://x.com/elonmusk/status/1798007748728365503\n\n> Tesla had no place to send the Nvidia chips to turn them on, so they would have just sat in a warehouse. \n> \n> The south extension of Giga Texas is almost complete. This will house 50k H100s for FSD training."", 'What a twist, the media kept reporting of “Tesla killers” for years, turns out it was Elon']",no content,elon musk ordered nvidia to ship thousands of ai chips reserved for tesla to x and xai,['first and foremost please read rteslamotors a new dawn we are not a support sub please make sure to use the proper resources if you have questions official tesla support rteslasupport rteslalounge personal content discord live chat for anythingnnni am a bot and this action was performed automatically please contact the moderators of this subredditmessagecomposetorteslamotors if you have any questions or concerns i can hear the securities class action already its obvious that he hasnt had the best interests for tesla in mind nnits time for him to go elons explanation tesla had no place to send the nvidia chips to turn them on so they would have just sat in a warehouse n n the south extension of giga texas is almost complete this will house 50k h100s for fsd training what a twist the media kept reporting of tesla killers for years turns out it was elon'],-0.296,0.0,[-0.1842],Neutral,Negative
More Tesla employees laid off as bloodbath enters its fourth week,3336,https://www.theverge.com/2024/5/6/24150274/tesla-layoffs-employee-fourth-week-elon-musk-ev-demand,735,1715015477,,"['[First and foremost, please read r/TeslaMotors - A New Dawn](https://www.reddit.com/r/teslamotors/comments/1c49sv0/rteslamotors_a_new_dawn/)\n\n\nAs we are not a support sub, please make sure to use the proper resources if you have questions: [Official Tesla Support](https://www.tesla.com/support), [r/TeslaSupport](https://www.reddit.com/r/TeslaSupport/) | [r/TeslaLounge](https://www.reddit.com/r/TeslaLounge/) personal content | [Discord Live Chat](https://discord.gg/tesla) for anything.\n\n\n*I am a bot, and this action was performed automatically. Please [contact the moderators of this subreddit](/message/compose/?to=/r/teslamotors) if you have any questions or concerns.*', 'Laying off people in the service department is mind-boggling. It still takes an upward of 2-3 weeks to get a service appointment here', 'So I guess you need to be prepared to only work 5 years or less if you accept a job there.  Interesting way to attract talent.', 'Some of our guys at our store was laid off. Whats next start closing stores? We’re planned to have 3+ more stores open in our area', ""This is being handled exceptionally badly.\n\nNo PR statements, no guidance on whether it's complete. This leads to a lack of confidence from both investors and employees.\n\nYou would have a difficult time trying to do this worse.""]",no content,more tesla employees laid off as bloodbath enters its fourth week,['first and foremost please read rteslamotors a new dawn we are not a support sub please make sure to use the proper resources if you have questions official tesla support rteslasupport rteslalounge personal content discord live chat for anythingnnni am a bot and this action was performed automatically please contact the moderators of this subredditmessagecomposetorteslamotors if you have any questions or concerns laying off people in the service department is mindboggling it still takes an upward of 23 weeks to get a service appointment here so i guess you need to be prepared to only work 5 years or less if you accept a job there interesting way to attract talent some of our guys at our store was laid off whats next start closing stores were planned to have 3 more stores open in our area this is being handled exceptionally badlynnno pr statements no guidance on whether its complete this leads to a lack of confidence from both investors and employeesnnyou would have a difficult time trying to do this worse'],-0.296,0.0,[0.8706],Neutral,Positive
Tesla now spends ad money to influence shareholders approval of Elon Musk's $55B payday,3799,https://electrek.co/2024/05/13/tesla-spends-ad-money-influence-shareholders-approval-elon-musk-55b-payday/,567,1715647876,,"['[First and foremost, please read r/TeslaMotors - A New Dawn](https://www.reddit.com/r/teslamotors/comments/1c49sv0/rteslamotors_a_new_dawn/)\n\n\nAs we are not a support sub, please make sure to use the proper resources if you have questions: [Official Tesla Support](https://www.tesla.com/support), [r/TeslaSupport](https://www.reddit.com/r/TeslaSupport/) | [r/TeslaLounge](https://www.reddit.com/r/TeslaLounge/) personal content | [Discord Live Chat](https://discord.gg/tesla) for anything.\n\n\n*I am a bot, and this action was performed automatically. Please [contact the moderators of this subreddit](/message/compose/?to=/r/teslamotors) if you have any questions or concerns.*', 'How are Vanguard and Black Rock voting?  That will decide the matter.', 'No. He shouldn’t have bought Twitter.', 'he has multiple ---spaceX,nuralink,boring -ect---places for income --he was promised a pay package based on performance--which he was doing great until he was sucked into the black hole of twitter--then things kinda went to shit----I have voted against his pay--you are laying off people by the thousands and still wanting the largest payday in history.', '55B$ could definitely help tesla with a lot lf its problems today.\nsuch a huge bonus should not be given to 1 person but rather distributed over the engineers and tecnicians who work hard to keep the company afloat']",no content,tesla now spends ad money to influence shareholders approval of elon musks 55b payday,['first and foremost please read rteslamotors a new dawn we are not a support sub please make sure to use the proper resources if you have questions official tesla support rteslasupport rteslalounge personal content discord live chat for anythingnnni am a bot and this action was performed automatically please contact the moderators of this subredditmessagecomposetorteslamotors if you have any questions or concerns how are vanguard and black rock voting that will decide the matter no he shouldnt have bought twitter he has multiple spacexnuralinkboring ectplaces for income he was promised a pay package based on performancewhich he was doing great until he was sucked into the black hole of twitterthen things kinda went to shiti have voted against his payyou are laying off people by the thousands and still wanting the largest payday in history 55b could definitely help tesla with a lot lf its problems todaynsuch a huge bonus should not be given to 1 person but rather distributed over the engineers and tecnicians who work hard to keep the company afloat'],-0.296,0.4767,[0.7698],Positive,Positive
"Tesla slashes its summer internship program to cut costs, as Elon Musk fights to save his $45 billion pay plan",3233,https://fortune.com/2024/05/01/tesla-slashes-summer-internship-program/,654,1714624926,,"['[First and foremost, please read r/TeslaMotors - A New Dawn](https://www.reddit.com/r/teslamotors/comments/1c49sv0/rteslamotors_a_new_dawn/)\n\n\nAs we are not a support sub, please make sure to use the proper resources if you have questions: [Official Tesla Support](https://www.tesla.com/support), [r/TeslaSupport](https://www.reddit.com/r/TeslaSupport/) | [r/TeslaLounge](https://www.reddit.com/r/TeslaLounge/) personal content | [Discord Live Chat](https://discord.gg/tesla) for anything.\n\n\n*I am a bot, and this action was performed automatically. Please [contact the moderators of this subreddit](/message/compose/?to=/r/teslamotors) if you have any questions or concerns.*', ""Jesus. What aren't they cutting? I just saw the head of HR also just left. At the rate they are cutting back you'd think they were going bankrupt not still the most valuable automaker in the world."", 'I do a lot of work with internship programs. This really is horrible for the interns. They had a top tier job for the summer and now are left to scramble to find another job when all the other programs are all full. \n\nIt’s also a very shitty move for Tesla. I’m sure the program was a drop in the bucket cost wise. But word will get out about this and people are going to be much less likely to apply for years to come.', ""Very unfortunate. I interned here in the past and worked with some brilliant interns. Elon used to be really charismatic but he's lost his charms over the years, with his seemingly increasing narcissism"", '[deleted]']",no content,tesla slashes its summer internship program to cut costs as elon musk fights to save his 45 billion pay plan,['first and foremost please read rteslamotors a new dawn we are not a support sub please make sure to use the proper resources if you have questions official tesla support rteslasupport rteslalounge personal content discord live chat for anythingnnni am a bot and this action was performed automatically please contact the moderators of this subredditmessagecomposetorteslamotors if you have any questions or concerns jesus what arent they cutting i just saw the head of hr also just left at the rate they are cutting back youd think they were going bankrupt not still the most valuable automaker in the world i do a lot of work with internship programs this really is horrible for the interns they had a top tier job for the summer and now are left to scramble to find another job when all the other programs are all full nnits also a very shitty move for tesla im sure the program was a drop in the bucket cost wise but word will get out about this and people are going to be much less likely to apply for years to come very unfortunate i interned here in the past and worked with some brilliant interns elon used to be really charismatic but hes lost his charms over the years with his seemingly increasing narcissism deleted'],-0.296,-0.4215,[0.6681],Negative,Positive
